{
  "id": "objective-billing-compatibility",
  "description": "The combination of campaign objective, ad set billing_event, and optimization_goal must be a supported Facebook Marketing API configuration. Invalid combinations are rejected by the API at apply time.",
  "severity": "ERROR",
  "condition": {
    "scope": "ad_set",
    "type": "compatibility_matrix",
    "row_field": "campaign.objective",
    "col_field": "billing_event",
    "third_field": "optimization_goal",
    "allowed": [
      ["OUTCOME_TRAFFIC", "IMPRESSIONS", "LINK_CLICKS"],
      ["OUTCOME_TRAFFIC", "IMPRESSIONS", "LANDING_PAGE_VIEWS"],
      ["OUTCOME_TRAFFIC", "IMPRESSIONS", "REACH"],
      ["OUTCOME_TRAFFIC", "IMPRESSIONS", "IMPRESSIONS"],
      ["OUTCOME_TRAFFIC", "LINK_CLICKS", "LINK_CLICKS"],
      ["OUTCOME_TRAFFIC", "LINK_CLICKS", "LANDING_PAGE_VIEWS"],
      ["OUTCOME_AWARENESS", "IMPRESSIONS", "REACH"],
      ["OUTCOME_AWARENESS", "IMPRESSIONS", "IMPRESSIONS"],
      ["OUTCOME_AWARENESS", "THRUPLAY", "THRUPLAY"],
      ["OUTCOME_ENGAGEMENT", "IMPRESSIONS", "PAGE_ENGAGEMENT"],
      ["OUTCOME_ENGAGEMENT", "IMPRESSIONS", "LINK_CLICKS"],
      ["OUTCOME_ENGAGEMENT", "IMPRESSIONS", "LANDING_PAGE_VIEWS"],
      ["OUTCOME_ENGAGEMENT", "IMPRESSIONS", "REACH"],
      ["OUTCOME_ENGAGEMENT", "IMPRESSIONS", "CONVERSATIONS"],
      ["OUTCOME_ENGAGEMENT", "PAGE_LIKES", "PAGE_LIKES"],
      ["OUTCOME_LEADS", "IMPRESSIONS", "LEAD_GENERATION"],
      ["OUTCOME_LEADS", "IMPRESSIONS", "QUALITY_LEAD"],
      ["OUTCOME_LEADS", "IMPRESSIONS", "LINK_CLICKS"],
      ["OUTCOME_LEADS", "IMPRESSIONS", "LANDING_PAGE_VIEWS"],
      ["OUTCOME_LEADS", "IMPRESSIONS", "CONVERSATIONS"],
      ["OUTCOME_SALES", "IMPRESSIONS", "OFFSITE_CONVERSIONS"],
      ["OUTCOME_SALES", "IMPRESSIONS", "VALUE"],
      ["OUTCOME_SALES", "IMPRESSIONS", "LINK_CLICKS"],
      ["OUTCOME_SALES", "IMPRESSIONS", "LANDING_PAGE_VIEWS"],
      ["OUTCOME_APP_PROMOTION", "IMPRESSIONS", "APP_INSTALLS"],
      ["OUTCOME_APP_PROMOTION", "IMPRESSIONS", "LINK_CLICKS"],
      ["REACH", "IMPRESSIONS", "REACH"],
      ["REACH", "IMPRESSIONS", "IMPRESSIONS"],
      ["LINK_CLICKS", "IMPRESSIONS", "LINK_CLICKS"],
      ["LINK_CLICKS", "LINK_CLICKS", "LINK_CLICKS"],
      ["PAGE_LIKES", "IMPRESSIONS", "PAGE_LIKES"],
      ["PAGE_LIKES", "PAGE_LIKES", "PAGE_LIKES"],
      ["POST_ENGAGEMENT", "IMPRESSIONS", "PAGE_ENGAGEMENT"],
      ["POST_ENGAGEMENT", "POST_ENGAGEMENT", "PAGE_ENGAGEMENT"],
      ["VIDEO_VIEWS", "IMPRESSIONS", "THRUPLAY"],
      ["VIDEO_VIEWS", "THRUPLAY", "THRUPLAY"],
      ["LEAD_GENERATION", "IMPRESSIONS", "LEAD_GENERATION"],
      ["CONVERSIONS", "IMPRESSIONS", "OFFSITE_CONVERSIONS"],
      ["CONVERSIONS", "IMPRESSIONS", "VALUE"],
      ["APP_INSTALLS", "IMPRESSIONS", "APP_INSTALLS"]
    ],
    "message": "Ad set '{name}' has an incompatible objective/billing_event/optimization_goal combination — this will be rejected by the Facebook API."
  }
}
